"95","Wind","Gansu","China","on the Feb.24 Gansu Jiuquan wind farm massive grid disconnection accident, they called it China’s largest and most severely affecting the power grid wind power accident in the last few years. CNB Daily learned during their research that the accident was caused by “low voltage ride through capability” failure and power grid development falling behind new energies development. ","http://deblockconsulting.com/blog/china-news/chinese-wind-farm-power-grid-disconnection-accident/","UNKNOWN","2","24","UNKNOWN","UNKNOWN","UNKNOWN","UNKNOWN","","","UNKNOWN","Structural break","0","0","0","0","1","0","Power grid","Mechanical (low voltage ride through capability)","Mechanical","Google","deblockconsulting.com","Chinese wind farm power grid disconnection accident"
"96","Wind","Huddersfield","UK","The damage occurred on Thursday night when, according to the Met Office wind speeds near Huddersfield peaked at 77mph during fierce storms which felled trees, tore off roof tiles and damaged power cables.","http://www.dailymail.co.uk/news/article-2083149/Wind-turbines-cope-UK-weather-3-blown-pieces.html","2012","1","5","UNKNOWN","UNKNOWN","UNKNOWN","UNKNOWN","","","January 5, 2012","Structural break","0","0","0","0","1","0","Blade","Nature (strong wind)","Nature","Google","Daily Mail","Wrecked by gales again as windfarms get £300,000 to switch off...in high winds"
"97","Wind","Tuokexun","China","A Ming Yang 1.5MW wind turbine collapsed in the course of commissioning, killing one and injuring three, on September 5 in north-west China's Xinjiang province. Ming Yang said that according to preliminary analysis, the tower fell because the foundation bolts were not properly fastened in the course of turbine installation.","http://www.windpowermonthly.com/news/rss/1149772/Ming-Yang-turbine-collapse-kills-one-injures-three/","2012","9","5","Ming Yang 1500 KW","Ming Yang","1500","UNKNOWN","","","September 5, 2012","Death & Injury","1","0","1","0","1","0","Tower","Mechanical (not properly secured foundation bolts)","Mechanical","Google","windpowermonthly.com","Ming Yang turbine collapse kills one, injures three"
"98","Wind","Irasburg, Vermont","USA","A trailer carrying a 115,000 pound base column for a wind turbine detached from the truck hauling it and rolled off Interstate 91 Southbound in Irasburg near the Orleans exit.","http://www.wcax.com/story/19069197/truck-carrying-wind-turbine-tips-on-i-91","2012","7","20","UNKNOWN","UNKNOWN","UNKNOWN","UNKNOWN","","","July 20, 2012","Structural break & Transportation accident ","0","0","0","0","1","1","Tower","Human (transportation)","Human","Google","wcax.com","Truck carrying wind turbine tips on I-91"
"99","Wind","Dubuque, Illinois","USA","No one was injured in the crash between two semi-tractor trailers this morning that caused more than $275,000 damage to a wind turbine propeller and restricted traffic for more than two hours.","http://www.thonline.com/news/breaking/article_fe7deb6c-c8d5-11e0-9ab6-001a4bcf6878.html","2011","8","17","UNKNOWN","UNKNOWN","UNKNOWN","UNKNOWN","","","August 17, 2011","Structural break & Transportation accident ","0","0","0","0","1","1","Blade","Human (transportation)","Human","Google","thonline.com","Accident involving wind turbine blade causes $275,000 damage"
"100","Wind","Minnesota","USA","A 29-year-old male rigger (victim) died after falling between 20-40 feet during wind turbine tower construction. He was wearing, but not using, a safety belt and lanyard at the time of the incident. ","http://www.cdc.gov/Niosh/FACE/stateface/mn/94mn013.html","1994","3","3","UNKNOWN","UNKNOWN","UNKNOWN","UNKNOWN","","","March 3, 1994","Death","1","0","0","0","0","0","Tower","Human (negligance)","Human","Google","cdv.gov","Construction Worker Dies After Falling From a Wind Turbine Tower"
"101","Wind","North Dakota","USA","An axle on a trailer carrying a tower for a wind turbine collapsed and caused a traffic snarl in West Fargo. The incident began when one of six axles on the trailer collapsed, landing part of the tower section on the road.","http://www.windaction.org/news/26896","2010","4","22","UNKNOWN","UNKNOWN","UNKNOWN","UNKNOWN","","","April 22, 2010","Structural break & Transportation accident ","0","0","0","0","1","1","Tower","Human (transportation)","Human","Google","windaction.org","Wind turbine accident snarls traffic in West Fargo "
"102","Wind","Crete","Greece","Vulture accident in southern Crete. People collected the wounded animal and took it to hospital where it was diagnosed with a broken wing and a limp. ","http://savetheeaglesinternational.org/459-2.html","UNKNOWN","UNKNOWN","UNKNOWN","UNKNOWN","UNKNOWN","UNKNOWN","UNKNOWN","","","UNKNOWN","Bird injury","0","0","1","0","0","0","Blade","Mechanical (due to collision)","Mechanical","Google","savetheeaglesinternationa.org","Vulture accident in southern Crete"
"103","Wind","Indiana","USA","An Ivy Tech Community College faculty member died Wednesday after he fell from a tower on the Lafayette campus. Craig Porter, 36, was on the tower around 12 p.m. conducting a ""rating exercise"" with students when he fell between 60-70 feet.","http://www.fox59.com/news/wxin-ivy-tech-ivy-tech-faculty-member-dies-after-fall-from-wind-turbine-20111102,0,7431080.column","2011","11","2","UNKNOWN","UNKNOWN","UNKNOWN","UNKNOWN","","","November 2, 2011","Death","1","0","0","0","0","0","Tower","UNKNOWN","UNKNOWN","Google","fox59.com","Ivy Tech faculty member dies after fall from tower"
"104","Wind","Baker City, Oregon","USA","A commercial truck trailer transporting a wind turbine base hit an embankment and crashed into the Burnt River on Interstate 84 just east of Baker City Saturday, police said.","http://www.kgw.com/news/Semi-carrying-windmill-base-crashes-in-I-84-173041461.html","2012","10","6","UNKNOWN","UNKNOWN","UNKNOWN","UNKNOWN","","","October 6, 2012","Transportation accident","0","0","0","0","0","1","Tower","Human (transportation)","Human","Google","kgw.com","Semi hauling wind turbine base goes into river"
"105","Wind","Island of Texel","Netherlands","A turbine crashed on the island of Texel (North of Holland).","http://tech.groups.yahoo.com/group/truth_about_wind/message/1780","2008","2","6","UNKNOWN","UNKNOWN","UNKNOWN","UNKNOWN","","","February 6, 2008","Structural break","0","0","0","0","1","0","Tower","UNKNOWN","UNKNOWN","Google","Yahoo Groups","HOLLAND - wind turbine accident in marina"
"106","Wind","Waterhouse Road","Australia","A wind turbine component fell from the back of a truck during transportation to the Musselroe Wind Farm site overnight.","http://www.examiner.com.au/story/301050/wind-turbine-part-falls-on-to-roadway/","2012","9","4","Vestas 3000 KW","Vestas","3000","168000","","","September 4, 2012","Transportation accident","0","0","0","0","0","1","Tower","Human (transportation)","Human","Google","examiner.com.au","Wind turbine part falls on the roadway"
"107","Wind","South Dakota","USA","Stephen C. McAdams, 40, was killed Friday afternoon at a construction site about six miles northeast of Kimball, S.D., according to Lt. Alan Welsh with the South Dakota Highway Patrol. McAdams was standing next to a pickup truck and talking to an occupant inside when he was trapped by a tractor-trailer trying to maneuver around the truck, Welsh said. The driver of the tractor-trailer turned too sharply and its flatbed trailer loaded with rebar trapped McAdams against the truck and then ran him over","http://www.wind-watch.org/news/2010/10/14/wrightsville-man-killed-in-accident-at-south-dakota-construction-site/","2010","10","8","UNKNOWN","UNKNOWN","UNKNOWN","UNKNOWN","","","October 8, 2010","Death","1","0","0","0","0","0","UNKNOWN","Human (negligance)","Human","Google","wind-watch.org","Wrightsville man killed in accident at South Dakota construction site   "
"108","Wind","Ontario","Canada","The diesel fuel spilled into Lake Ontario near Wolfe Island around 9:30 a.m. Wednesday from a boat carrying equipment for a controversial wind turbine project.","http://www.cbc.ca/news/canada/ottawa/story/2008/10/02/ot-wind-081002.html","2008","10","1","UNKNOWN","UNKNOWN","UNKNOWN","UNKNOWN","","","October 1, 2008","Transportation accident","0","0","0","0","1","1","UNKNOWN","Human","Human","Google","CBC","Wind project ship spills fuel near Wolfe Island"
"109","Wind","North Wales","UK","The 3.6 MW wind turbines arrive at Mostyn harbour, North Wales, directly by barge from Esbjerg, Denmark. The main tower is assembled first, followed by the turbine nacelle, hub and finally the three blades are fitted. It is thought that the incident involved one of the 80 tonne, 25 metre turbine top towers which was dropped during lifting.","http://www.vertikal.net/en/news/story/12541/","2011","3","7","3600 KW","UNKNOWN","3600","367000","","","March 7, 2011","Structural break","0","0","0","0","1","0","Tower","Mechanical","Mechanical","Google","Vertikal.net","Lifting incident at Mostyn Port"
"110","Wind","Faula,Scotland","UK","An all-night black-out has had to be brought into force for the 22 homes on the isolated Shetland community, because of problems in the island's £1.5 million hydro and solar power schemes. Foula's three wind turbines have been out of action since Christmas, when 100mph winds damaged the blades ...Now islanders are back to relying on costly diesel generator until the faults can be rectified. ","http://www.scotsman.com/news/environment/green-isle-forced-to-revert-to-diesel-1-2261777","2012","4","28","UNKNOWN","UNKNOWN","UNKNOWN","UNKNOWN","","","April 28, 2012","Mechanical","0","0","0","0","0","0","Blade","Nature (strong wind)","Nature","Google","windaction.org","Green isle forced to revert to diesel"
"111","Wind","Minnesota","USA","Lightning claimed a “victim” Wednesday in rural Lake Benton, hitting and setting ablaze the blades of a Buffalo Ridge wind turbine","http://www.brookingsregister.com/v2_news_articles.php?heading=0&page=76&story_id=15161","2012","8","6","UNKNOWN","UNKNOWN","UNKNOWN","UNKNOWN","","","August 6, 2012","Structural break","0","0","0","0","1","0","Blade","Nature (lightening strike)","Nature","Google","The Brookings Registers","Fire in the sky"
"112","Wind","North Sea","Germany","A British diver has died during maintenance work at an offshore German wind farm in the North Sea, according to officials.","http://www.timesofmalta.com/articles/view/20120504/world/diver-dies-at-wind-turbine-site.418279","2012","5","4","UNKNOWN","UNKNOWN","UNKNOWN","UNKNOWN","","","May 4, 2012","Death","1","0","0","0","0","0","Tower","Human","Human","Google","Times of Malta","Diver dies at wind turbine site"
"113","Wind","Texas","USA","A man working inside a wind turbine in Nolan County when it was struck by lightning Monday was listed in stable condition at a Sweetwater hospital, according to fire officials.","http://www.reporternews.com/news/2012/may/07/man-working-in-turbine-struck-by-lightning-is/?partner=yahoo_feeds","2012","5","7","UNKNOWN","UNKNOWN","UNKNOWN","UNKNOWN","","","May 7, 2012","Death","1","0","0","0","1","0","Tower","Nature (lightening strike)","Nature","Google","Reporternews.com","Man working in turbine struck by lightning is hospitalized "
"114","Wind","Scotland","UK","The latest casualty of wind farm roads that are unsuited for cranes or big aerial lifts is a 103 metre WT1000 truck mounted aerial lift which rolled as it approached the Gordonbush wind farm in Scotland.","http://www.vertikal.net/en/news/story/14828/","2012","5","11","UNKNOWN","UNKNOWN","UNKNOWN","UNKNOWN","","","May 11, 2012","Transportation accident","0","0","0","0","0","1","Crane","Human (transportation)","Human","Google","Vertikal.net","More wind farm rolls"
"115","Wind","UNKNOWN","Brazil","A severe accident happened two months ago in Brazil, involving a truck with a wind tower part, and a bus. ","http://ecotretas.blogspot.pt/2012/05/accident-with-bus-and-wind-tower-on.html","2012","3","UNKNOWN","UNKNOWN","UNKNOWN","UNKNOWN","UNKNOWN","","","UNKNOWN","Death & Transportation accident","1","0","0","0","0","1","Tower","Human (transportation)","Human","Google","Blogspot","Accident with bus and a wind tower on truck, causes 17 deaths"
"116","Wind","Kansas","USA","Five turbines were also destroyed at a nearby wind farm that’s still under construction. ","http://www.wind-watch.org/news/2012/05/21/crews-in-harper-county-cleaning-up-after-saturdays-tornado/","2012","5","19","GE 1600 KW","GE","1600","419000","","","May 19, 2012","Structural break","0","0","0","0","1","0","Tower","Nature (tornado)","Nature","Google","wind-watch.org","Crews in Harper County cleaning up after Saturday’s tornado"
"117","Wind","Iowa","USA","A wind turbine near Grafton caught fire Tuesday afternoon.","http://www.kimt.com/content/localnews/story/Wind-Turbine-Fire/0WxPEoYavUK6JddbmQl-3w.cspx","2012","5","22","Gamesa 2000 KW","Gamesa","2000","UNKNOWN","","","May 22, 2012","Fire & Structural break","0","1","0","0","1","0","Nacelle","Mechanical (fire)","Mechanical","Google","kimt tv","Wind Turbine Fire "
"118","Wind","Ireland","UK","The owners of a French-made wind turbine have been advised to keep people away from them after bits started falling off.","http://www.bbc.co.uk/news/uk-northern-ireland-18330468","2012","6","6","Scirocco 6 KW","Scirocco","6","UNKNOWN","","","June 6, 2012","Structural break","0","0","0","0","1","0","Blade","Mechanical","Mechanical","Google","BBC","Design snag causes wind turbine shutdown"
"119","Wind","El Bonillo","Spain","Vestas is currently carrying out investigations to find the root cause of the electric arc flash,"" she added. Once finalised, she said Vestas would inform its customers and take any necessary actions.","http://www.windpowermonthly.com/news/1135647/Fire-Vestas-turbine/","2012","6","9","Vestas 2000 kW","Vestas","2000","50000","","","June 9, 2012","Fire & Injury","0","1","1","0","0","0","Nacelle","Mechanical","Mechanical","Google","windpowermonthly.com","Fire in Vestas turbine"
"120","Wind","Illinois","USA","The 1.6-megawatt turbine is 5 to 6 miles east of Watseka on Iroquois County Road 2700 East, just off of U.S. 24.","http://www.paxtonrecord.net/news/business/agriculture/2012-06-18/wind-turbine-found-damaged-iroquois-county.html","2012","6","18","GE 1600 KW","GE","1600","UNKNOWN","","","June 18, 2012","Structural break","0","0","0","0","1","0","Blade","Mechanical","Mechanical","Google","windpowermonthly.com","Wind turbine found damaged in Iroquois County"
"121","Wind","Nepal","India","A 500 KW wind turbine generator installed near Panagudi suffered extensive damage in a fire accident on Sunday evening.","http://www.wind-watch.org/news/2012/06/25/fire-destroys-windmill/","2012","6","24","500 KW","UNKNOWN","500","UNKNOWN","","","June 24, 2012","Mechanical","0","0","0","1","0","0","Generator","Mechanical (fire)","Mechanical","Google","windpowermonthly.com","Fire destroys windmill"
"122","Wind","Vermont","USA","Evening a trailer carrying a 115,000 pound base column for a wind turbine detached from the truck hauling it and rolled off Interstate 91 Southbound in Irasburg near the Orleans exit.","http://www.wind-watch.org/news/2012/07/20/truck-carrying-wind-turbine-tips-on-i-91/","2012","7","19","UNKNOWN","UNKNOWN","UNKNOWN","UNKNOWN","","","July 19, 2012","Transportation accident","0","0","0","0","0","1","Tower","Human (transportation)","Human","Google","windpowermonthly.com","Truck carrying wind turbine tips on I-91  "
"123","Wind","Maine","USA","A trailer carrying a section of a wind turbine tower to the Bull Hill project site overturned Monday, dumping the tower section into a ditch alongside a private road off Route 9. ","http://bangordailynews.com/2012/07/30/news/hancock/truck-carrying-wind-turbine-tower-section-to-bull-hill-site-dumps-load-into-ditch/","2012","7","30","Vestas 1800 KW","Vestas","1800","34000","","","July 30, 2012","Transportation accident","0","0","0","0","0","1","Tower","Human (transportation)","Human","Google","windpowermonthly.com","Truck carrying wind turbine tower section to Bull Hill site dumps load into ditch"
"124","Wind","California","USA","A wildland fire that started at a wind turbine facility in Riverside County last month provides fuel for opponents concerned about fire risks posed by industrial-scale wind projects.","http://www.wind-watch.org/news/2012/08/01/cal-fire-wind-turbine-generator-caused-wildland-fire-that-charred-367-acres/","2012","6","17","UNKNOWN","UNKNOWN","UNKNOWN","UNKNOWN","","","June 17, 2012","Fire","0","1","0","0","0","0","Generator","Mechanical","Mechanical","Google","windpowermonthly.com","Cal Fire: wind turbine generator caused wildland fire that charred 367 acres  "
"125","Wind","Oregon","USA","Sherman County authorities have identified the victim of Saturday's wind turbine accident as Chadd B. Mitchell, a 34-year-old Goldendale, Wash., man. ","http://blog.oregonlive.com/breakingnews/2007/08/authorities_identify_victim_of.html","2007","7","22","Siemens 2300 KW","Siemens","2300","101200","","","July 22, 2007","Structural break","1","0","1","0","1","0","Tower","Nature","Nature","Google","Oregon Live","Authorities identify victim of wind turbine accident as 34-year-old Goldendale, Wash., man"
"126","Wind","Schleswig-Holstein","Germany","A crane operator has been killed while installing a Vestas turbine in northern Germany, the company has revealed.","http://www.windpowermonthly.com/news/1162667/Crane-operator-killed-installing-Vestas-turbine/?DCMP=ILC-SEARCH","2012","12","4","Vestas 2000 KW","Vestas","2000","44000","","","December 4, 2012","Structural break","1","0","0","0","1","0","Blade","UNKNOWN","UNKNOWN","Google","windpowermonthly.com","Crane operator killed installing Vestas turbine"
"127","Wind","Illinois","USA","A spokeswoman for Invenergy Wind said that, in the event of high winds, the turbines are designed to come to rest with one blade pointing down and parallel to the base of the tower.","http://www.windaction.org/pictures/28682","2010","7","23","GE 1500 KW","GE","1500","100500","","","July 23, 2010","Mechanical","0","0","0","1","0","0","Blade","Nature (strong wind)","Nature","Google","windaction.org","Blade failure at Grand Ridge wind site "
"128","Wind","Mannhagen","Germany","A blade dropped onto the crane cabin during installation by the subcontractor.","http://www.rechargenews.com/energy/wind/article328668.ece","2012","12","3","Vestas 2000 KW","Vestas","2000","44000","","","December 3, 2012","Death","1","0","0","0","1","0","Blade","UNKNOWN","UNKNOWN","Google","Rechargenews.com","Falling blade kills worker during Vestas installation in Germany"
"129","Wind","Montana","USA","Tim McCartney, a top tower removing small turbine","http://www.wind-works.org/articles/deaths02.html","1975","UNKNOWN","UNKNOWN","UNKNOWN","UNKNOWN","UNKNOWN","UNKNOWN","","","UNKNOWN","Death","1","0","0","0","0","0","Tower","UNKNOWN","UNKNOWN","Google","wind-works.org","Deaths from Working with Wind Energy"
"130","Wind","UNKNOWN","UK","When a technician was descending down the ladder from the transition piece, 
the platform hatch dropped down and hit him on the head. The procedure is to 
be changed to leaving the hatch open when you leave the transition piece.","http://www.decc.gov.uk/assets/decc/what%20we%20do/a%20low%20carbon%20uk/1_20091120130307_e_@@_barrowannualreportjuly2007tojune2008final.pdf","2008","2","21","UNKNOWN","UNKNOWN","UNKNOWN","UNKNOWN","","","February 21, 2008","Injury","0","0","1","0","0","0","Transition piece","Human","Human","Google","decc.gov.uk","Offshore wind capital grant scheme"
"131","Wind","Bushland, Texas","USA","Pat Acker, 28, rebar cage for foundation","http://www.wind-works.org/articles/deaths02.html","1982","UNKNOWN","UNKNOWN","UNKNOWN","UNKNOWN","UNKNOWN","UNKNOWN","","","UNKNOWN","Death","1","0","0","0","0","0","Tower","UNKNOWN","UNKNOWN","Google","wind-works.org","Deaths from Working with Wind Energy"
"132","Wind","Palm Springs, California","USA","Eric Wright on experimental VAWT","http://www.wind-works.org/articles/deaths02.html","1983","UNKNOWN","UNKNOWN","UNKNOWN","UNKNOWN","UNKNOWN","UNKNOWN","","","UNKNOWN","Death","1","0","0","0","0","0","UNKNOWN","UNKNOWN","UNKNOWN","Google","wind-works.org","Deaths from Working with Wind Energy"
"133","Wind","Altamont Pass, California","USA","J.A. Doucette, unloading towers from a truck","http://www.wind-works.org/articles/deaths02.html","1984","UNKNOWN","UNKNOWN","UNKNOWN","UNKNOWN","UNKNOWN","UNKNOWN","","","UNKNOWN","Death","1","0","0","0","0","0","Tower","UNKNOWN","UNKNOWN","Google","wind-works.org","Deaths from Working with Wind Energy"
"134","Wind","Palm Springs, California","USA","Art Gomez, servicing Dynergy crane","http://www.wind-works.org/articles/deaths02.html","1984","UNKNOWN","UNKNOWN","UNKNOWN","UNKNOWN","UNKNOWN","UNKNOWN","","","UNKNOWN","Death","1","0","0","0","0","0","Crane","UNKNOWN","UNKNOWN","Google","wind-works.org","Deaths from Working with Wind Energy"
"135","Wind","Tehachapi, California","USA","Thomas Swan, crane operator","http://www.wind-works.org/articles/deaths02.html","1991","UNKNOWN","UNKNOWN","UNKNOWN","UNKNOWN","UNKNOWN","UNKNOWN","","","UNKNOWN","Death","1","0","0","0","0","0","Crane","UNKNOWN","UNKNOWN","Google","wind-works.org","Deaths from Working with Wind Energy"
"136","Wind","Palm Springs, California","USA","Richard Zawlocki, dscndng. tower","http://www.wind-works.org/articles/deaths02.html","1992","UNKNOWN","UNKNOWN","UNKNOWN","UNKNOWN","UNKNOWN","UNKNOWN","","","UNKNOWN","Death","1","0","0","0","0","0","Tower","UNKNOWN","UNKNOWN","Google","wind-works.org","Deaths from Working with Wind Energy"
"137","Wind","Illinois","USA","Robert Skarski, erecting small wind turbine","http://www.wind-works.org/articles/deaths02.html","1993","UNKNOWN","UNKNOWN","2 KW","UNKNOWN","2","UNKNOWN","","","UNKNOWN","Death","1","0","0","0","0","0","UNKNOWN","UNKNOWN","UNKNOWN","Google","wind-works.org","Deaths from Working with Wind Energy"
"138","Wind","Minnesota","USA","Mark (Eddie) Ketterling, erecting tower","http://www.wind-works.org/articles/deaths02.html","1994","UNKNOWN","UNKNOWN","UNKNOWN","UNKNOWN","UNKNOWN","UNKNOWN","","","UNKNOWN","Death","1","0","0","0","0","0","Tower","UNKNOWN","UNKNOWN","Google","wind-works.org","Deaths from Working with Wind Energy"
"139","Wind","UNKNOWN","UNKNOWN","Bernhard Saxen, 42, Kaiser-Wilhelm Koog test field","http://www.wind-works.org/articles/deaths02.html","1997","UNKNOWN","UNKNOWN","UNKNOWN","UNKNOWN","UNKNOWN","UNKNOWN","","","UNKNOWN","Death","1","0","0","0","0","0","UNKNOWN","UNKNOWN","UNKNOWN","Google","wind-works.org","Deaths from Working with Wind Energy"
"140","Wind","Mid Glamorgan, Wales","UK","Two blades were hit by lightning, one at Taff Ely in Mid Glamorgan.","http://webarchive.nationalarchives.gov.uk/+/http://www.dti.gov.uk/NewReview/nr36/html/wind.html","1997","12","15","UNKNOWN","UNKNOWN","UNKNOWN","9000","","","December 15, 1997","Structural break","0","0","0","0","1","0","Blade","Nature (lightening strike)","Nature","Google","webarchive.nationalarchives.gov.uk","Wind farms withstand winter storms"
"141","Wind","UNKNOWN","UNKNOWN","Ivan Sørensen, 'Vestas windsmith, near Lemvig, removing turbine","http://www.wind-works.org/articles/deaths02.html","1997","UNKNOWN","UNKNOWN","UNKNOWN","UNKNOWN","UNKNOWN","UNKNOWN","","","UNKNOWN","Death","1","0","0","0","0","0","UNKNOWN","UNKNOWN","UNKNOWN","Google","wind-works.org","Deaths from Working with Wind Energy"
"142","Wind","UNKNOWN","UNKNOWN","Jens Erik Madsen (DK), servicing controller","http://www.wind-works.org/articles/deaths02.html","1982","UNKNOWN","UNKNOWN","UNKNOWN","UNKNOWN","UNKNOWN","UNKNOWN","","","UNKNOWN","Death","1","0","0","0","0","0","UNKNOWN","UNKNOWN","UNKNOWN","Google","wind-works.org","Deaths from Working with Wind Energy"
"143","Wind","Iowa","USA","Ugene Stallhut, ground crew on Jacobs 10 kW","http://www.wind-works.org/articles/deaths02.html","1984","UNKNOWN","UNKNOWN","10 KW","UNKNOWN","10","UNKNOWN","","","UNKNOWN","Death","1","0","0","0","0","0","UNKNOWN","UNKNOWN","UNKNOWN","Google","wind-works.org","Deaths from Working with Wind Energy"
"144","Wind","Palm Springs, California","USA","John Donnelly, atop nacelle","http://www.wind-works.org/articles/deaths02.html","1989","UNKNOWN","UNKNOWN","UNKNOWN","UNKNOWN","UNKNOWN","UNKNOWN","","","UNKNOWN","Death","1","0","0","0","0","0","Nacelle","UNKNOWN","UNKNOWN","Google","wind-works.org","Deaths from Working with Wind Energy"
"145","Wind","UNKNOWN","Netherlands","Dick Hozeman (NL), atop nacelle","http://www.wind-works.org/articles/deaths02.html","1990","UNKNOWN","UNKNOWN","UNKNOWN","UNKNOWN","UNKNOWN","UNKNOWN","","","UNKNOWN","Death","1","0","0","0","0","0","Nacelle","UNKNOWN","UNKNOWN","Google","wind-works.org","Deaths from Working with Wind Energy"
"146","Wind","UNKNOWN","UNKNOWN","Leif Thomsen, & Kaj Vadstrup (DK), srvcng. rotor","http://www.wind-works.org/articles/deaths02.html","1990","UNKNOWN","UNKNOWN","UNKNOWN","UNKNOWN","UNKNOWN","UNKNOWN","","","UNKNOWN","Death","1","0","0","0","0","0","Rotor","UNKNOWN","UNKNOWN","Google","wind-works.org","Deaths from Working with Wind Energy"
"147","Wind","North Dakota","USA","Employee #1 was struck in the head by pipes being lowered into a windmill tower. Employee #1 later died due to a blood clot in the lungs. ","http://www.osha.gov/pls/imis/establishment.inspection_detail?id=304208507","2003","5","13","UNKNOWN","UNKNOWN","UNKNOWN","UNKNOWN","","","May 13, 2003","Death","1","0","0","0","0","0","UNKNOWN","UNKNOWN","Mechanical","Google","osha.gov","Inspection: 304208507 - Stemen Drilling"
"148","Wind","UNKNOWN","Germany","UNKNOWN","http://www.wind-works.org/articles/deaths02.html","2003","UNKNOWN","UNKNOWN","UNKNOWN","UNKNOWN","UNKNOWN","UNKNOWN","","","UNKNOWN","Death","1","0","0","0","0","0","UNKNOWN","UNKNOWN","UNKNOWN","Google","wind-works.org","Deaths from Working with Wind Energy"
